10000	FP Restoration upon Successive Attacks	-1	1	
10001	Taking attacks improves attack power	-1	1	
10002	Switching Weapons Boosts Attack Power	-1	1	
11000	[Wylder] +1 additional Character Skill use	-1	1	
11001	Flask Also Heals Allies	-1	1	
11002	[Wylder] Art gauge greatly filled when ability is activated	-1	1	
12000	[Guardian] Increased duration for Character Skill	-1	1	
12001	Art gauge charged from successful guarding	-1	1	
12002	[Guardian] Slowly restores nearby allies' HP while Art is active	-1	1	
12003	[Guardian] Slowly restores nearby allies' HP while Art is active	-1	1	
13000	Physical attack power increases after using grease items	-1	1	
13001	Critical Hits Earn Runes	-1	1	
13002	Improved Attack Power with 3+ Bows Equipped	-1	1	
14000	[Duchess] Successive dagger attack reprises event upon nearby enemies	-1	1	
14001	[Duchess] Become difficult to spot and silence footsteps after landing critical from behind	-1	1	
14002	Slowly restore HP for self and nearby allies when HP is low	-1	1	
15000	[Raider] Duration of Ultimate Art extended	-1	1	
15001	[Raider] Damage taken while using Character Skill improves attack power and stamina	-1	1	
15002	Defeating enemies near Totem Stela restores HP	-1	1	
16000	[Revenant] Strengthens family and allies when Ultimate Art is activated	-1	1	
16001	Increased rune acquisition for self and allies	-1	1	
16002	[Revenant] Expend own HP to fully heal nearby allies when activating Art	-1	1	
17000	Attack power increased for each evergaol prisoner defeated	-1	1	
17001	Max FP Up with 3+ Staves Equipped	-1	1	
17002	[Recluse] Suffer blood loss and increase attack power upon Art activation	-1	1	
18000	HP restored when using medicinal boluses, etc.	-1	1	
18001	Art gauge fills moderately upon critical hit	-1	1	
18002	[Executor] Roaring restores HP while Art is active	-1	1	
100000	Taking attacks improves attack power	-1	100	
310000	Increased Maximum HP	-1	-1	
310100	Increased Maximum FP	-1	-1	
310200	Increased Maximum Stamina	-1	-1	
310400	Increased Maximum HP	-1	-1	
310401	Increased Maximum Stamina	-1	-1	
311000	Improved Item Discovery	-1	-1	
311100	More Runes From Defeated Enemies	-1	-1	
311500	Improved Stamina Recovery	-1	-1	
311600	Improved Blood Loss Resistance	-1	-1	
311601	Improved Frost Resistance	-1	-1	
311700	Improved Poison Resistance	-1	-1	
311701	Improved Rot Resistance	-1	-1	
311800	Improved Sleep Resistance	-1	-1	
311801	Improved Madness Resistance	-1	-1	
311900	Improved Death Blight Resistance	-1	-1	
312000	Improved Poison & Rot Resistance	-1	-1	
312001	Improved Blood Loss & Frost Resistance	-1	-1	
312002	Improved Sleep & Madness Resistance	-1	-1	
312100	Improved Poise	-1	-1	
312300	Improved Skill Attack Power	-1	-1	
312500	Improved Dexterity	-1	-1	
312501	Successive Attacks Boost Attack Power	-1	-1	
320000	Improved Magic Attack Power	-1	-1	
320001	Impaired Physical Damage Negation	-1	-1	
320100	Improved Lightning Attack Power	-1	-1	
320101	Impaired Physical Damage Negation	-1	-1	
320200	Improved Fire Attack Power	-1	-1	
320201	Impaired Physical Damage Negation	-1	-1	
320300	Improved Holy Attack Power	-1	-1	
320301	Impaired Physical Damage Negation	-1	-1	
320400	Improved Attack Power at Low HP	-1	-1	
320500	Improved Attack Power at Full HP	-1	-1	
320600	Improved Thrusting Counterattack	-1	-1	
320700	Improved Guard Breaking	-1	-1	
320800	Successive Attacks Boost Attack Power	-1	-1	
320801	null	-1	-1	
320900	Improved Critical Hits	-1	-1	
321000	Projectile Damage Drop-Off Reduced	-1	-1	
321200	Improved Chain Attack Finishers	-1	-1	
321300	Improved Charge Attacks	-1	-1	
321500	Improved Ranged Weapon Attacks	-1	-1	
321600	Blood Loss in Vicinity Increases Attack Power	-1	-1	
321700	Poison & Rot in Vicinity Increases Attack Power	-1	-1	
321800	Improved Jump Attacks	-1	-1	
321900	Improved Roar & Breath Attacks	-1	-1	
322000	Improved Guard Counters	-1	-1	
322100	Improved Throwing Pots	-1	-1	
322200	Improved Perfuming Arts	-1	-1	
330000	Improved Sorceries	-1	-1	
330400	Improved Incantations	-1	-1	
330600	Extended Spell Duration	-1	-1	
330700	Improved Spell Casting Speed	-1	-1	
330800	Reduced Spell FP Cost	-1	-1	
330801	Maximum HP Down	-1	-1	
330900	Improved Charged Spells & Skills	-1	-1	
340000	Improved Physical Damage Negation	-1	-1	
340100	Improved Magic Damage Negation	-1	-1	
340200	Improved Fire Damage Negation	-1	-1	
340300	Improved Lightning Damage Negation	-1	-1	
340400	Improved Holy Damage Negation	-1	-1	
340500	Improved Affinity Damage Negation	-1	-1	
340700	Improved Dodging	-1	-1	
340701	Impaired Damage Negation	-1	-1	
340800	Improved Damage Negation at Low HP	-1	-1	
340900	Improved Damage Negation at Full HP	-1	-1	
341000	Improved Guarding Ability	-1	-1	
350000	Improved Flask HP Restoration	-1	-1	
350200	Continuous HP Recovery	-1	-1	
350300	Defeating Enemies Restores HP	-1	-1	
350400	Successive Attack HP Restoration	-1	-1	
350500	Critical Hit HP Restoration	-1	-1	
350600	Critical Hit FP Restoration	-1	-1	
360200	Reduced Skill FP Cost	-1	-1	
360700	No Rune Loss or Level Down Upon Death	-1	-1	
361100	Defeating Enemies Restores FP	-1	-1	
370000	Improved Item Discovery	-1	-1	
370001	More Runes From Defeated Enemies	-1	-1	
370002	Continuous HP Loss	-1	-1	
6001400	Physical Attack Up +3	100	1000	
6001401	Physical Attack Up +4	100	1000	
6001500	Magic Attack Power Up +3	100	1000	
6001501	Magic Attack Power Up +4	100	1000	
6001600	Fire Attack Power Up +3	100	1000	
6001601	Fire Attack Power Up +4	100	1000	
6001700	Lightning Attack Power Up +3	100	1000	
6001701	Lightning Attack Power Up +4	100	1000	
6001800	Holy Attack Power Up +3	100	1000	
6001801	Holy Attack Power Up +4	100	1000	
6002600	Improved Magic Damage Negation +1	7002600	1000	
6002601	Improved Magic Damage Negation +2	7002600	1000	
6002700	Improved Fire Damage Negation +1	7002700	1000	
6002701	Improved Fire Damage Negation +2	7002700	1000	
6002800	Improved Lightning Damage Negation +1	7002800	1000	
6002801	Improved Lightning Damage Negation +2	7002800	1000	
6002900	Improved Holy Damage Negation +1	7002900	1000	
6002901	Improved Holy Damage Negation +2	7002900	1000	
6003000	Improved Poison Resistance +1	7003000	1000	
6003001	Improved Poison Resistance +2	7003000	1000	
6003100	Improved Blood Loss Resistance +1	7003100	1000	
6003101	Improved Blood Loss Resistance +2	7003100	1000	
6003200	Improved Sleep Resistance +1	7003200	1000	
6003201	Improved Sleep Resistance +2	7003200	1000	
6003300	Improved Death Blight Resistance +1	7003300	1000	
6003301	Improved Death Blight Resistance +2	7003300	1000	
6003400	Improved Rot Resistance +1	7003400	1000	
6003401	Improved Rot Resistance +2	7003400	1000	
6003500	Improved Frost Resistance +1	7003500	1000	
6003501	Improved Frost Resistance +2	7003500	1000	
6003600	Improved Madness Resistance +1	7003600	1000	
6003601	Improved Madness Resistance +2	7003600	1000	
6005600	Partial HP Restoration upon Post-Damage Attacks +1	7005600	100	
6005601	Partial HP Restoration upon Post-Damage Attacks +2	7005600	100	
6030200	HP restored when using medicinal boluses, etc. +1	7030200	100	
6030600	Art gauge charged from successful guarding +1	7030600	100	
6030800	Art gauge fills moderately upon critical hit +1	7030800	100	
6030900	Physical attack power increases after using grease items +1	100	100	
6030901	Physical attack power increases after using grease items +2	100	100	
6035100	Critical Hit Boosts Stamina Recovery Speed +1	7035100	100	
6040100	Improved Guard Counters +1	100	100	
6040101	Improved Guard Counters +2	100	100	
6040300	Improved Throwing Pot Damage +1	7040300	100	
6040400	Improved Throwing Knife Damage +1	7040400	100	
6040500	Improved Glintstone and Gravity Stone Damage +1	7040500	100	
6043100	Improved Perfuming Arts +1	7043100	100	
6060300	Max HP increased for each great enemy defeated at a Great Church.	6060300	100	
6060400	Runes and Item Discovery increased for each great enemy defeated at a Fort	6060400	100	
6060500	Arcane increased for each great enemy defeated at a Ruin	6060500	100	
6060600	Max stamina increased for each great enemy defeated at a Great Encampment	6060600	100	
6090000	Defeating enemies fills more of the Art gauge +1	7090000	100	
6160000	HP Restoration upon Thrusting Counterattack +1	7160000	100	
6260000	Attack power up when facing poison-afflicted enemy +1	7260300	100	
6260001	Attack power up when facing poison-afflicted enemy +2	7260300	100	
6260300	Attack power up when facing scarlet rot-afflictedenemy +1	7260300	100	
6260301	Attack power up when facing scarlet rot-afflictedenemy +2	7260300	100	
6260400	Attack power up when facing frostbite-afflictedenemy +1	7260400	100	
6260401	Attack power up when facing frostbite-afflictedenemy +2	7260400	100	
6500000	[Wylder] Character Skill inflicts Blood Loss	900	1	
6500100	[Guardian] Character Skill Boosts Damage Negation of Nearby Allies	900	1	
6500200	[Ironeye] Character Skill Inflicts Heavy Poison Damage on Poisoned Enemies	900	1	
6500300	[Duchess] Use Character Skill for Brief Invulnerability	900	1	
6500400	[Raider] Hit With Character Skill to Reduce Enemy Attack Power	900	1	
6500500	[Revenant] Increased Max FP upon Ability Activation	900	1	
6500600	[Recluse] Collect Affinity Residues to Negate Affinity	900	1	
6500700	[Executor] Slowly Restore HP upon Ability Activation	900	1	
6600000	Sleep in Vicinity Improves Attack Power	100	100	
6600001	Sleep in Vicinity Improves Attack Power +1	100	100	
6600100	Madness in Vicinity Improves Attack Power	100	100	
6600101	Madness in Vicinity Improves Attack Power +1	100	100	
6610400	Increased Maximum HP	6610400	1000	
6610500	Increased Maximum FP	6610500	1000	
6610600	Increased Maximum Stamina	6610600	1000	
6610700	Reduced FP Consumption	6610700	1000	
6610800	Improved Affinity Attack Power	100	1000	
6610801	Improved Affinity Attack Power +1	100	1000	
6610802	Improved Affinity Attack Power +2	100	1000	
6611001	Improved Physical Damage Negation +1	7006200	1000	
6611002	Improved Physical Damage Negation +2	7006200	1000	
6611100	Improved Affinity Damage Negation	6611100	1000	
6611101	Improved Affinity Damage Negation +1	6611100	1000	
6611102	Improved Affinity Damage Negation +2	6611100	1000	
6611200	Improved Sorceries	6611200	100	
6611201	Improved Sorceries +1	6611200	100	
6611202	Improved Sorceries +2	6611200	100	
6611300	Improved Incantations	6611300	100	
6611301	Improved Incantations +1	6611300	100	
6611302	Improved Incantations +2	6611300	100	
6611400	Improved Flask HP Restoration	6611400	100	
6621000	Crimsonspill Crystal Tear in possession at start of expedition	6621000	100	
6621100	Crimson Crystal Tear in possession at start of expedition	6621000	100	
6621200	Cerulean Crystal Tear in possession at start of expedition	6621000	100	
6621300	Speckled Hardtear in possession at start of expedition	6621000	100	
6621400	Crimson Bubbletear in possession at start of expedition	6621000	100	
6621500	Opaline Bubbletear in possession at start of expedition	6621000	100	
6621600	Crimsonburst Crystal Tear in possession at start of expedition	6621000	100	
6621700	Greenburst Crystal Tear in possession at start of expedition	6621000	100	
6621800	Opaline Hardtear in possession at start of expedition	6621000	100	
6621900	Thorny Cracked Tear in possession at start of expedition	6621000	100	
6622000	Spiked Cracked Tear in possession at start of expedition	6621000	100	
6622100	Windy Crystal Tear in possession at start of expedition	6621000	100	
6622200	Ruptured Crystal Tear in possession at start of expedition	6621000	100	
6622300	Leaden Hardtear in possession at start of expedition	6621000	100	
6622400	Twiggy Cracked Tear in possession at start of expedition	6621000	100	
6622500	Crimsonwhorl Bubbletear in possession at start of expedition	6621000	100	
6622600	Cerulean Hidden Tear in possession at start of expedition	6621000	100	
6622700	Stonebarb Cracked Tear in possession at start of expedition	6621000	100	
6622800	Flame-Shrouding Cracked Tear in possession at start of expedition	6621000	100	
6622900	Magic-Shrouding Cracked Tear in possession at start of expedition	6621000	100	
6623000	Lightning-Shrouding Cracked Tear in possession at start of expedition	6621000	100	
6623100	Holy-Shrouding Cracked Tear in possession at start of expedition	6621000	100	
6624000	Uplifting Aromatic in possession at start of expedition	6624000	100	
6624100	Spark Aromatic in possession at start of expedition	6624000	100	
6624200	Ironjar Aromatic in possession at start of expedition	6624000	100	
6624300	Bloodboil Aromatic in possession at start of expedition	6624000	100	
6624400	Poison Spraymist in possession at start of expedition	6624000	100	
6624500	Acid Spraymist in possession at start of expedition	6624000	100	
6630000	Dormant Power Helps Discover Daggers	6630000	100	
6630100	Dormant Power Helps Discover Straight Swords	6630000	100	
6630200	Dormant Power Helps Discover Greatswords	6630000	100	
6630300	Dormant Power Helps Discover Colossal Swords	6630000	100	
6630400	Dormant Power Helps Discover Curved Swords	6630000	100	
6630500	Dormant Power Helps Discover Curved Greatswords	6630000	100	
6630600	Dormant Power Helps Discover Katana	6630000	100	
6630700	Dormant Power Helps Discover Twinblades	6630000	100	
6630800	Dormant Power Helps Discover Thrusting Swords	6630000	100	
6630900	Dormant Power Helps Discover Heavy Thrusting Swords	6630000	100	
6631000	Dormant Power Helps Discover Axes	6630000	100	
6631100	Dormant Power Helps Discover Greataxes	6630000	100	
6631200	Dormant Power Helps Discover Hammers	6630000	100	
6631300	Dormant Power Helps Discover Great Hammers	6630000	100	
6631400	Dormant Power Helps Discover Flails	6630000	100	
6631500	Dormant Power Helps Discover Spears	6630000	100	
6631600	Dormant Power Helps Discover Great Spears	6630000	100	
6631700	Dormant Power Helps Discover Halberds	6630000	100	
6631800	Dormant Power Helps Discover Reapers	6630000	100	
6631900	Dormant Power Helps Discover Fists	6630000	100	
6632000	Dormant Power Helps Discover Claws	6630000	100	
6632100	Dormant Power Helps Discover Whips	6630000	100	
6632200	Dormant Power Helps Discover Colossal Weapons	6630000	100	
6632300	Dormant Power Helps Discover Bows	6630000	100	
6632400	Dormant Power Helps Discover Greatbows	6630000	100	
6632500	Dormant Power Helps Discover Crossbows	6630000	100	
6632600	Dormant Power Helps Discover Ballistas	6630000	100	
6632700	Dormant Power Helps Discover Small Shields	6630000	100	
6632800	Dormant Power Helps Discover Medium Shields	6630000	100	
6632900	Dormant Power Helps Discover Greatshields	6630000	100	
6633000	Dormant Power Helps Discover Staves	6630000	100	
6633100	Dormant Power Helps Discover Sacred Seals	6630000	100	
6633200	Dormant Power Helps Discover Torches	6630000	100	
6640000	[Wylder] Improved Mind, Reduced Vigor	900	1	
6640100	[Wylder] Improved Intelligence and Faith, Reduced Strength and Dexterity	900	1	
6641000	[Guardian] Improved Strength and Dexterity, Reduced Vigor	900	1	
6641100	[Guardian] Improved Mind and Faith, Reduced Vigor	900	1	
6642000	[Ironeye] Improved Arcane, Reduced Dexterity	900	1	
6642100	[Ironeye] Improved Vigor and Strength, Reduced Dexterity	900	1	
6643000	[Duchess] Improved Vigor and Strength, Reduced Mind	900	1	
6643100	[Duchess] Improved Mind and Faith, Reduced Intelligence	900	1	
6644000	[Raider] Improved Mind and Intelligence, Reduced Vigor and Endurance	900	1	
6644100	[Raider] Improved Arcane, Reduced Vigor	900	1	
6645000	[Revenant] Improved Vigor and Endurance, Reduced Mind	900	1	
6645100	[Revenant] Improved Strength, Reduced Faith	900	1	
6646000	[Recluse] Improved Vigor, Endurance, and Dexterity, Reduced Intelligence and Faith	900	1	
6646100	[Recluse] Improved Intelligence and Faith, Reduced Mind	900	1	
6647000	[Executor] Improved Vigor and Endurance, Reduced Arcane	900	1	
6647100	[Executor] Improved Dexterity and Arcane, Reduced Vigor	900	1	
6820000	Taking Damage Causes Poison Buildup	6820000	6820000	
6820100	Taking Damage Causes Rot Buildup	6820100	6820100	
6820200	Taking Damage Causes Frost Buildup	6820200	6820200	
6820300	Taking Damage Causes Blood Loss Buildup	6820300	6820300	
6820400	Taking Damage Causes Madness Buildup	6820400	6820400	
6820500	Taking Damage Causes Sleep Buildup	6820500	6820500	
6820600	Taking Damage Causes Death Buildup	6820600	6820600	
6830000	Reduced Strength and Intelligence	6830000	6830000	
6830100	Reduced Dexterity and Faith	6830100	6830100	
6830200	Reduced Intelligence and Dexterity	6830200	6830200	
6830300	Reduced Faith and Strength	6830300	6830300	
6830400	Reduced Vigor and Arcane	6830400	6830400	
6840000	Reduced Rune Acquisition	6840000	6840000	
6840100	Reduced Flask HP Restoration	6840100	6840100	
6840200	Ultimate Art Charging Impaired	6840200	6840200	
6850200	All Resistances Down	6850200	8762000	
6850500	Continuous HP Loss	6850500	8766000	
6850700	More Damage Taken After Evasion	6850700	8800100	
6850800	Repeated Evasions Lower Damage Negation	6850800	8800200	
6850900	Reduced Damage Negation for Flask Usages	6850900	8801000	
6851200	Lower Attack When Below Max HP	6851200	8810000	
6851300	Poison Buildup When Below Max HP	6851300	8810300	
6851400	Rot Buildup When Below Max HP	6851400	8810400	
6851700	Near Death Reduces Max HP	6851700	8831200	
7000000	Vigor +1	7000000	1000	52
7000001	Vigor +2	7000000	1000	52
7000002	Vigor +3	7000000	1000	52
7000090	Increased Maximum HP	7000000	1	
7000100	Mind +1	7000100	1000	52
7000101	Mind +2	7000100	1000	52
7000102	Mind +3	7000100	1000	52
7000190	Increased Maximum FP	7000100	1	
7000200	Endurance +1	7000200	1000	52
7000201	Endurance +2	7000200	1000	52
7000202	Endurance +3	7000200	1000	52
7000290	Increased Maximum Stamina	7000200	1	
7000300	Strength +1	7000300	1000	52
7000301	Strength +2	7000300	1000	52
7000302	Strength +3	7000300	1000	52
7000400	Dexterity +1	7000400	1000	52
7000401	Dexterity +2	7000400	1000	52
7000402	Dexterity +3	7000400	1000	52
7000500	Intelligence +1	7000500	1000	52
7000501	Intelligence +2	7000500	1000	52
7000502	Intelligence +3	7000500	1000	52
7000600	Faith +1	7000600	1000	52
7000601	Faith +2	7000600	1000	52
7000602	Faith +3	7000600	1000	52
7000700	Arcane +1	7000700	1000	52
7000701	Arcane +2	7000700	1000	52
7000702	Arcane +3	7000700	1000	52
7000800	Character Skill Cooldown Reduction +1	7000800	1000	47
7000801	Character Skill Cooldown Reduction +2	7000800	1000	47
7000802	Character Skill Cooldown Reduction +3	7000800	1000	47
7000900	Ultimate Art Gauge +1	7000900	1000	47
7000901	Ultimate Art Gauge +2	7000900	1000	47
7000902	Ultimate Art Gauge +3	7000900	1000	47
7001000	Poise +1	7001000	1000	47
7001001	Poise +2	7001000	1000	47
7001002	Poise +3	7001000	1000	47
7001100	Continuous HP Recovery	7001100	100	
7001400	Physical Attack Up	100	1000	47
7001401	Physical Attack Up +1	100	1000	47
7001402	Physical Attack Up +2	100	1000	47
7001500	Magic Attack Power Up	100	1000	47
7001501	Magic Attack Power Up +1	100	1000	47
7001502	Magic Attack Power Up +2	100	1000	47
7001600	Fire Attack Power Up	100	1000	47
7001601	Fire Attack Power Up +1	100	1000	47
7001602	Fire Attack Power Up +2	100	1000	47
7001700	Lightning Attack Power Up	100	1000	47
7001701	Lightning Attack Power Up +1	100	1000	47
7001702	Lightning Attack Power Up +2	100	1000	47
7001800	Holy Attack Power Up	100	1000	47
7001801	Holy Attack Power Up +1	100	1000	47
7001802	Holy Attack Power Up +2	100	1000	47
7002600	Magic Damage Negation Up	7002600	1000	47
7002700	Fire Damage Negation Up	7002700	1000	47
7002800	Lightning Damage Negation Up	7002800	1000	47
7002900	Holy Damage Negation Up	7002900	1000	47
7003000	Improved Poison Resistance	7003000	1000	47
7003100	Improved Blood Loss Resistance	7003100	1000	47
7003200	Improved Sleep Resistance	7003200	1000	47
7003300	Improved Death Blight Resistance	7003300	1000	47
7003400	Improved Rot Resistance	7003400	1000	47
7003500	Improved Frost Resistance	7003500	1000	47
7003600	Improved Madness Resistance	7003600	1000	47
7005600	Partial HP Restoration upon Post-Damage Attacks	7005600	100	46
7006000	Improved Stance-Breaking when Two-Handing	100	100	46
7006001	Improved Stance-Breaking when Two-Handing	7006001	100	
7006100	Improved Stance-Breaking when Wielding Two Armaments	100	100	46
7006101	Improved Stance-Breaking when Wielding Two Armaments	7006101	100	
7006200	Improved Physical Damage Negation	7006200	1000	
7010200	Flask Also Heals Allies	7010200	100	46
7010500	[Wylder] Art activation spreads fire in area	900	1	67
7010700	[Duchess] Successive dagger attack reprises event upon nearby enemies	900	1	67
7010900	[Revenant] Expend own HP to fully heal nearby allies when activating Art	900	1	67
7011000	[Guardian] Increased duration for Character Skill	900	1	67
7011200	[Revenant] Trigger ghostflame explosion during Ultimate Art activation	900	1	67
7011600	[Guardian] Creates whirlwind when charging halberd attacks	900	1	67
7011700	[Executor] Roaring restores HP while Art is active	900	1	67
7012000	[Guardian] Slowly restores nearby allies' HP while Art is active	900	1	67
7012200	Slowly restore HP for self and nearby allies when HP is low	7012200	100	46
7012300	Improved Damage Negation at Low HP	7012300	100	46
7020000	[Wylder] Standard attacks enhanced with fiery follow-ups when using Character Skill (greatsword only)	900	1	67
7030000	Improved Poise Near Totem Stela	900	1	67
7030200	HP restored when using medicinal boluses, etc.	7030200	100	46
7030600	Art gauge charged from successful guarding	7030600	100	46
7030700	Draw enemy attention while guarding	7030700	100	46
7030800	Art gauge fills moderately upon critical hit	7030800	100	46
7030900	Physical attack power increases after using grease items	100	100	46
7031200	[Revenant] Strengthens family and allies when Ultimate Art is activated	900	1	67
7031300	[Raider] Damage taken while using Character Skill improves attack power and stamina	900	1	67
7031800	[Duchess] Become difficult to spot and silence footsteps after landing critical from behind	900	1	67
7031900	Critical Hits Earn Runes	7031900	101	46
7032200	Taking attacks improves attack power	100	100	46
7032400	[Wylder] Art gauge greatly filled when ability is activated	900	1	67
7032700	[Duchess] Defeating enemies while Art is active ups attack power	900	1	67
7032800	[Recluse] Collecting affinity residue activates Terra Magica	900	1	67
7032900	[Recluse] Suffer blood loss and increase attack power upon Art activation	900	1	67
7033200	[Wylder] +1 additional Character Skill use	900	1	67
7033400	[Guardian] Successful guards send out shockwaves while ability is active	900	1	67
7034100	[Recluse] Activating Ultimate Art raises Max HP	900	1	67
7034400	[Executor] Character Skill Boosts Attack but Attacking Drains HP	900	1	67
7034500	[Executor] While Character Skill is active, unlocking use of cursed sword restores HP	900	1	67
7034600	[Ironeye] Art Charge Activation Adds Poison Effect	900	1	67
7034700	[Ironeye] Boosts thrusting counterattacks after executing Art	900	1	67
7035100	Critical Hit Boosts Stamina Recovery Speed	7035100	100	46
7035400	Gesture "Crossed Legs" Builds Up Madness	7035400	100	
7035410	Gesture "Crossed Legs" Builds Up Madness	7035410	100	
7035500	Madness Continually Recovers FP	7035500	100	
7035510	Madness Continually Recovers FP	7035510	100	
7035700	Switching Weapons Adds an Affinity Attack	7035700	1	
7035800	Boosts Attack Power of Added Affinity Attacks	7035800	10	
7035900	Switching Weapons Boosts Attack Power	100	100	
7036000	FP Restoration upon Successive Attacks	7036000	1	
7036100	HP Recovery From Successful Guarding	7036100	1	46
7040000	Improved Initial Standard Attack	100	100	46
7040100	Improved Guard Counters	100	100	46
7040200	Improved Critical Hits	100	100	46
7040201	Improved Critical Hits +1	7040201	1	
7040300	Improved Throwing Pot Damage	7040300	100	39
7040400	Improved Throwing Knife Damage	7040400	100	39
7040500	Improved Glintstone and Gravity Stone Damage	7040500	100	39
7043000	Improved Roar & Breath Attacks	100	100	39
7043100	Improved Perfuming Arts	7043100	100	39
7043200	Improved Stonedigger Sorcery	800	100	39
7043300	Improved Carian Sword Sorcery	800	100	39
7043400	Improved Glintblade Sorcery	800	100	39
7043500	Improved Invisibility Sorcery	800	100	39
7043600	Improved Crystalian sorcery	800	100	39
7043700	Improved Gravity Sorcery	800	100	39
7043800	Improved Thorn Sorcery	800	100	39
7044000	Improved Fundamentalist Incantations	800	100	39
7044100	Improved Dragon Cult Incantations	800	100	39
7044200	Improved Giants' Flame Incantations	800	100	39
7044300	Improved Godslayer Incantations	800	100	39
7044400	Improved Bestial Incantations	800	100	39
7044500	Improved Frenzied Flame Incantations	800	100	39
7044600	Improved Dragon Communion Incantations	800	100	39
7050000	Raised stamina recovery for nearby allies, but not for self	7050000	100	46
7050100	Items confer effect to all nearby allies	7050100	100	46
7060000	Attack power increased for each evergaol prisoner defeated	100	100	46
7060100	Max FP increased for each Sorcerer's Rise unlocked	7060100	100	46
7060200	Attack power increased for each Night Invader defeated	100	100	46
7070000	Treasure marked upon map	7070000	100	46
7080000	Improved Attack Power with 3+ Daggers Equipped	100	10	10
7080100	Improved Attack Power with 3+ Straight Swords Equipped	100	10	10
7080200	Improved Attack Power with 3+ Greatswords Equipped	100	10	10
7080300	Improved Attack Power with 3+ Colossal Swords Equipped	100	10	10
7080400	Improved Attack Power with 3+ Curved Swords Equipped	100	10	10
7080500	Improved Attack Power with 3+ Curved Greatswords Equipped	100	10	10
7080600	Improved Attack Power with 3+ Katana Equipped	100	10	10
7080700	Improved Attack Power with 3+ Twinblades Equipped	100	10	10
7080800	Improved Attack Power with 3+ Thrusting Swords Equipped	100	10	10
7080900	Improved Attack Power with 3+ Heavy Thrusting Swords Equipped	100	10	10
7081000	Improved Attack Power with 3+ Axes Equipped	100	10	10
7081100	Improved Attack Power with 3+ Greataxes Equipped	100	10	10
7081200	Improved Attack Power with 3+ Hammers Equipped	100	10	10
7081300	Improved Attack Power with 3+ Great Hammers Equipped	100	10	10
7081400	Improved Attack Power with 3+ Flails Equipped	100	10	10
